,all_awardings,approved_at_utc,approved_by,archived,associated_award,author,author_flair_background_color,author_flair_css_class,author_flair_richtext,author_flair_template_id,author_flair_text,author_flair_text_color,author_flair_type,author_fullname,author_is_blocked,author_patreon_flair,author_premium,awarders,banned_at_utc,banned_by,body,body_html,can_gild,can_mod_post,collapsed,collapsed_because_crowd_control,collapsed_reason,collapsed_reason_code,comment_type,controversiality,created,created_utc,depth,distinguished,downs,edited,gilded,gildings,id,is_submitter,likes,link_id,locked,mod_note,mod_reason_by,mod_reason_title,mod_reports,name,no_follow,num_reports,parent_id,permalink,removal_reason,replies,report_reasons,saved,score,score_hidden,send_replies,stickied,subreddit,subreddit_id,subreddit_name_prefixed,subreddit_type,top_awarded_type,total_awards_received,treatment_tags,unrepliable_reason,ups,user_reports,kind
data,[],,,False,,ezekielraiden,,,[],,,,text,t2_16nhu9,False,False,False,[],,,"It depends what you mean by ""completely voided.""

If the tank is genuinely exposed to vacuum pumping for long enough, then all that is inside is vacuum. Perhaps a tiny, tiny trace of other gases, but otherwise it's empty. Nothing. Zip.

If however you just mean that it's been vented until it is at atmospheric pressure, then the same gas that was already there is still in there, it's just at ambient pressure.","&lt;div class=""md""&gt;&lt;p&gt;It depends what you mean by &amp;quot;completely voided.&amp;quot;&lt;/p&gt;

&lt;p&gt;If the tank is genuinely exposed to vacuum pumping for long enough, then all that is inside is vacuum. Perhaps a tiny, tiny trace of other gases, but otherwise it&amp;#39;s empty. Nothing. Zip.&lt;/p&gt;

&lt;p&gt;If however you just mean that it&amp;#39;s been vented until it is at atmospheric pressure, then the same gas that was already there is still in there, it&amp;#39;s just at ambient pressure.&lt;/p&gt;
&lt;/div&gt;",False,False,False,,,,,0,1714153061.0,1714153061.0,0,,0,False,0,{},l1drwig,False,,t3_1cdrdus,False,,,,[],t1_l1drwig,False,,t3_1cdrdus,/r/explainlikeimfive/comments/1cdrdus/eli5_whats_left_in_spent_gas_tanks/l1drwig/,,"{'kind': 'Listing', 'data': {'after': None, 'dist': None, 'modhash': None, 'geo_filter': '', 'children': [{'kind': 't1', 'data': {'subreddit_id': 't5_2sokd', 'approved_at_utc': None, 'author_is_blocked': False, 'comment_type': None, 'awarders': [], 'mod_reason_by': None, 'banned_by': None, 'author_flair_type': 'text', 'total_awards_received': 0, 'subreddit': 'explainlikeimfive', 'author_flair_template_id': None, 'likes': None, 'replies': {'kind': 'Listing', 'data': {'after': None, 'dist': None, 'modhash': None, 'geo_filter': '', 'children': [{'kind': 't1', 'data': {'subreddit_id': 't5_2sokd', 'approved_at_utc': None, 'author_is_blocked': False, 'comment_type': None, 'awarders': [], 'mod_reason_by': None, 'banned_by': None, 'author_flair_type': 'text', 'total_awards_received': 0, 'subreddit': 'explainlikeimfive', 'author_flair_template_id': None, 'likes': None, 'replies': '', 'user_reports': [], 'saved': False, 'id': 'l1gdb51', 'banned_at_utc': None, 'mod_reason_title': None, 'gilded': 0, 'archived': False, 'collapsed_reason_code': None, 'no_follow': True, 'author': 'Elianor_tijo', 'can_mod_post': False, 'send_replies': True, 'parent_id': 't1_l1dsfge', 'score': 3, 'author_fullname': 't2_lxxm5', 'removal_reason': None, 'approved_by': None, 'mod_note': None, 'all_awardings': [], 'body': ""Technically, diffusion will also occur at some point. That is the atmospheric gases and moisture will diffuse ever so slightly in the tank if you leave the valve open.\n\nFor most applications this is a non issue. However, if you are talking lab grade high purity gases, your gas supplier often doesn't like you emptying the tank until it's at atmospheric pressure. That means doing a full decontamination of the tank to make sure it will meet those specs.\n\nAt my previous workplace, our supplier didn't like us getting the tanks below about 200 psi for that reason."", 'edited': False, 'top_awarded_type': None, 'downs': 0, 'author_flair_css_class': None, 'name': 't1_l1gdb51', 'is_submitter': False, 'collapsed': False, 'author_flair_richtext': [], 'author_patreon_flair': False, 'body_html': '&lt;div class=""md""&gt;&lt;p&gt;Technically, diffusion will also occur at some point. That is the atmospheric gases and moisture will diffuse ever so slightly in the tank if you leave the valve open.&lt;/p&gt;\n\n&lt;p&gt;For most applications this is a non issue. However, if you are talking lab grade high purity gases, your gas supplier often doesn&amp;#39;t like you emptying the tank until it&amp;#39;s at atmospheric pressure. That means doing a full decontamination of the tank to make sure it will meet those specs.&lt;/p&gt;\n\n&lt;p&gt;At my previous workplace, our supplier didn&amp;#39;t like us getting the tanks below about 200 psi for that reason.&lt;/p&gt;\n&lt;/div&gt;', 'gildings': {}, 'collapsed_reason': None, 'distinguished': None, 'associated_award': None, 'stickied': False, 'author_premium': False, 'can_gild': False, 'link_id': 't3_1cdrdus', 'unrepliable_reason': None, 'author_flair_text_color': None, 'score_hidden': False, 'permalink': '/r/explainlikeimfive/comments/1cdrdus/eli5_whats_left_in_spent_gas_tanks/l1gdb51/', 'subreddit_type': 'public', 'locked': False, 'report_reasons': None, 'created': 1714189184.0, 'author_flair_text': None, 'treatment_tags': [], 'created_utc': 1714189184.0, 'subreddit_name_prefixed': 'r/explainlikeimfive', 'controversiality': 0, 'depth': 2, 'author_flair_background_color': None, 'collapsed_because_crowd_control': None, 'mod_reports': [], 'num_reports': None, 'ups': 3}}], 'before': None}}, 'user_reports': [], 'saved': False, 'id': 'l1dsfge', 'banned_at_utc': None, 'mod_reason_title': None, 'gilded': 0, 'archived': False, 'collapsed_reason_code': None, 'no_follow': True, 'author': 'Cold-Economist2858', 'can_mod_post': False, 'created_utc': 1714153239.0, 'send_replies': True, 'parent_id': 't1_l1drwig', 'score': 2, 'author_fullname': 't2_vjx5tzgoa', 'removal_reason': None, 'approved_by': None, 'mod_note': None, 'all_awardings': [], 'body': 'Makes sense! I meant the latter, but the former is good to know as well. Thanks!', 'edited': False, 'top_awarded_type': None, 'author_flair_css_class': None, 'name': 't1_l1dsfge', 'is_submitter': True, 'downs': 0, 'author_flair_richtext': [], 'author_patreon_flair': False, 'body_html': '&lt;div class=""md""&gt;&lt;p&gt;Makes sense! I meant the latter, but the former is good to know as well. Thanks!&lt;/p&gt;\n&lt;/div&gt;', 'gildings': {}, 'collapsed_reason': None, 'distinguished': None, 'associated_award': None, 'stickied': False, 'author_premium': False, 'can_gild': False, 'link_id': 't3_1cdrdus', 'unrepliable_reason': None, 'author_flair_text_color': None, 'score_hidden': False, 'permalink': '/r/explainlikeimfive/comments/1cdrdus/eli5_whats_left_in_spent_gas_tanks/l1dsfge/', 'subreddit_type': 'public', 'locked': False, 'report_reasons': None, 'created': 1714153239.0, 'author_flair_text': None, 'treatment_tags': [], 'collapsed': False, 'subreddit_name_prefixed': 'r/explainlikeimfive', 'controversiality': 0, 'depth': 1, 'author_flair_background_color': None, 'collapsed_because_crowd_control': None, 'mod_reports': [], 'num_reports': None, 'ups': 2}}], 'before': None}}",,False,14,False,True,False,explainlikeimfive,t5_2sokd,r/explainlikeimfive,public,,0,[],,14,[],t1
data_1,[],,,False,,TheJeeronian,,,[],,,,text,t2_3spgt7bd,False,False,False,[],,,"Under normal use a tank will not be completely voided of its original contents. An ""empty"" propane tank is usually still pressurized with propane gas and you'd best hope it stays that way for your own safety.

There are circumstances where the last little bit is intentionally pumped out and replaced with something else, but that ""something else"" can be whatever the situation demands.

Oh, unless the tank is an acetylene tank, in which case acetone is left over.","&lt;div class=""md""&gt;&lt;p&gt;Under normal use a tank will not be completely voided of its original contents. An &amp;quot;empty&amp;quot; propane tank is usually still pressurized with propane gas and you&amp;#39;d best hope it stays that way for your own safety.&lt;/p&gt;

&lt;p&gt;There are circumstances where the last little bit is intentionally pumped out and replaced with something else, but that &amp;quot;something else&amp;quot; can be whatever the situation demands.&lt;/p&gt;

&lt;p&gt;Oh, unless the tank is an acetylene tank, in which case acetone is left over.&lt;/p&gt;
&lt;/div&gt;",False,False,False,,,,,0,1714152968.0,1714152968.0,0,,0,False,0,{},l1drmne,False,,t3_1cdrdus,False,,,,[],t1_l1drmne,False,,t3_1cdrdus,/r/explainlikeimfive/comments/1cdrdus/eli5_whats_left_in_spent_gas_tanks/l1drmne/,,"{'kind': 'Listing', 'data': {'after': None, 'dist': None, 'modhash': None, 'geo_filter': '', 'children': [{'kind': 't1', 'data': {'subreddit_id': 't5_2sokd', 'approved_at_utc': None, 'author_is_blocked': False, 'comment_type': None, 'awarders': [], 'mod_reason_by': None, 'banned_by': None, 'author_flair_type': 'text', 'total_awards_received': 0, 'subreddit': 'explainlikeimfive', 'author_flair_template_id': None, 'likes': None, 'replies': '', 'user_reports': [], 'saved': False, 'id': 'l1dsjho', 'banned_at_utc': None, 'mod_reason_title': None, 'gilded': 0, 'archived': False, 'collapsed_reason_code': None, 'no_follow': True, 'author': 'Cold-Economist2858', 'can_mod_post': False, 'created_utc': 1714153276.0, 'send_replies': True, 'parent_id': 't1_l1drmne', 'score': 2, 'author_fullname': 't2_vjx5tzgoa', 'removal_reason': None, 'approved_by': None, 'mod_note': None, 'all_awardings': [], 'body': 'Cool. Thanks for the info!', 'edited': False, 'top_awarded_type': None, 'author_flair_css_class': None, 'name': 't1_l1dsjho', 'is_submitter': True, 'downs': 0, 'author_flair_richtext': [], 'author_patreon_flair': False, 'body_html': '&lt;div class=""md""&gt;&lt;p&gt;Cool. Thanks for the info!&lt;/p&gt;\n&lt;/div&gt;', 'gildings': {}, 'collapsed_reason': None, 'distinguished': None, 'associated_award': None, 'stickied': False, 'author_premium': False, 'can_gild': False, 'link_id': 't3_1cdrdus', 'unrepliable_reason': None, 'author_flair_text_color': None, 'score_hidden': False, 'permalink': '/r/explainlikeimfive/comments/1cdrdus/eli5_whats_left_in_spent_gas_tanks/l1dsjho/', 'subreddit_type': 'public', 'locked': False, 'report_reasons': None, 'created': 1714153276.0, 'author_flair_text': None, 'treatment_tags': [], 'collapsed': False, 'subreddit_name_prefixed': 'r/explainlikeimfive', 'controversiality': 0, 'depth': 1, 'author_flair_background_color': None, 'collapsed_because_crowd_control': None, 'mod_reports': [], 'num_reports': None, 'ups': 2}}, {'kind': 't1', 'data': {'subreddit_id': 't5_2sokd', 'approved_at_utc': None, 'author_is_blocked': False, 'comment_type': None, 'awarders': [], 'mod_reason_by': None, 'banned_by': None, 'author_flair_type': 'text', 'total_awards_received': 0, 'subreddit': 'explainlikeimfive', 'author_flair_template_id': None, 'likes': None, 'replies': '', 'user_reports': [], 'saved': False, 'id': 'l1ermcn', 'banned_at_utc': None, 'mod_reason_title': None, 'gilded': 0, 'archived': False, 'collapsed_reason_code': None, 'no_follow': True, 'author': 'JoushMark', 'can_mod_post': False, 'created_utc': 1714165466.0, 'send_replies': True, 'parent_id': 't1_l1drmne', 'score': 2, 'author_fullname': 't2_d0ttu', 'removal_reason': None, 'approved_by': None, 'mod_note': None, 'all_awardings': [], 'body': ""Unless it's pumped out a tank that holds a gas (or a material in liquid phase that turns into a gas as the pressure drops, like propane/LNG) will flow until the pressure inside the tank matches the air pressure around the tank, then the tank will be filled with whatever the tank was holding (LNG/Propane/nitrogen/etc) at the same pressure as the surrounding air. \n\nIf you do pump the tank out, emptying it until there is nothing inside the tank might be crushed by the surrounding air pressure. \n\nIn the case of a liquid tank, like the fuel tank of a car, it's intentionally filled with air from the surrounding area as the liquid is pumped out so the tank doesn't have to hold up to air pressure from the outside and it doesn't get harder to pump it out as the pressure drops in the tank."", 'edited': False, 'top_awarded_type': None, 'author_flair_css_class': None, 'name': 't1_l1ermcn', 'is_submitter': False, 'downs': 0, 'author_flair_richtext': [], 'author_patreon_flair': False, 'body_html': '&lt;div class=""md""&gt;&lt;p&gt;Unless it&amp;#39;s pumped out a tank that holds a gas (or a material in liquid phase that turns into a gas as the pressure drops, like propane/LNG) will flow until the pressure inside the tank matches the air pressure around the tank, then the tank will be filled with whatever the tank was holding (LNG/Propane/nitrogen/etc) at the same pressure as the surrounding air. &lt;/p&gt;\n\n&lt;p&gt;If you do pump the tank out, emptying it until there is nothing inside the tank might be crushed by the surrounding air pressure. &lt;/p&gt;\n\n&lt;p&gt;In the case of a liquid tank, like the fuel tank of a car, it&amp;#39;s intentionally filled with air from the surrounding area as the liquid is pumped out so the tank doesn&amp;#39;t have to hold up to air pressure from the outside and it doesn&amp;#39;t get harder to pump it out as the pressure drops in the tank.&lt;/p&gt;\n&lt;/div&gt;', 'gildings': {}, 'collapsed_reason': None, 'distinguished': None, 'associated_award': None, 'stickied': False, 'author_premium': False, 'can_gild': False, 'link_id': 't3_1cdrdus', 'unrepliable_reason': None, 'author_flair_text_color': None, 'score_hidden': False, 'permalink': '/r/explainlikeimfive/comments/1cdrdus/eli5_whats_left_in_spent_gas_tanks/l1ermcn/', 'subreddit_type': 'public', 'locked': False, 'report_reasons': None, 'created': 1714165466.0, 'author_flair_text': None, 'treatment_tags': [], 'collapsed': False, 'subreddit_name_prefixed': 'r/explainlikeimfive', 'controversiality': 0, 'depth': 1, 'author_flair_background_color': None, 'collapsed_because_crowd_control': None, 'mod_reports': [], 'num_reports': None, 'ups': 2}}, {'kind': 't1', 'data': {'subreddit_id': 't5_2sokd', 'approved_at_utc': None, 'author_is_blocked': False, 'comment_type': None, 'awarders': [], 'mod_reason_by': None, 'banned_by': None, 'author_flair_type': 'text', 'total_awards_received': 0, 'subreddit': 'explainlikeimfive', 'author_flair_template_id': None, 'likes': None, 'replies': '', 'user_reports': [], 'saved': False, 'id': 'l1gqm8z', 'banned_at_utc': None, 'mod_reason_title': None, 'gilded': 0, 'archived': False, 'collapsed_reason_code': None, 'no_follow': True, 'author': 'krisalyssa', 'can_mod_post': False, 'created_utc': 1714196617.0, 'send_replies': True, 'parent_id': 't1_l1drmne', 'score': 1, 'author_fullname': 't2_cs24pgas', 'removal_reason': None, 'approved_by': None, 'mod_note': None, 'all_awardings': [], 'body': 'And that vermiculite-like stuff whose name escapes me at the moment.', 'edited': False, 'top_awarded_type': None, 'author_flair_css_class': None, 'name': 't1_l1gqm8z', 'is_submitter': False, 'downs': 0, 'author_flair_richtext': [], 'author_patreon_flair': False, 'body_html': '&lt;div class=""md""&gt;&lt;p&gt;And that vermiculite-like stuff whose name escapes me at the moment.&lt;/p&gt;\n&lt;/div&gt;', 'gildings': {}, 'collapsed_reason': None, 'distinguished': None, 'associated_award': None, 'stickied': False, 'author_premium': False, 'can_gild': False, 'link_id': 't3_1cdrdus', 'unrepliable_reason': None, 'author_flair_text_color': None, 'score_hidden': False, 'permalink': '/r/explainlikeimfive/comments/1cdrdus/eli5_whats_left_in_spent_gas_tanks/l1gqm8z/', 'subreddit_type': 'public', 'locked': False, 'report_reasons': None, 'created': 1714196617.0, 'author_flair_text': None, 'treatment_tags': [], 'collapsed': False, 'subreddit_name_prefixed': 'r/explainlikeimfive', 'controversiality': 0, 'depth': 1, 'author_flair_background_color': None, 'collapsed_because_crowd_control': None, 'mod_reports': [], 'num_reports': None, 'ups': 1}}], 'before': None}}",,False,8,False,True,False,explainlikeimfive,t5_2sokd,r/explainlikeimfive,public,,0,[],,8,[],t1
data_2,[],,,False,,DBDude,,,[],,,,text,t2_9eu97,False,False,False,[],,,"It's not empty. It's just gas at the same pressure as the surrounding atmosphere. There's no pressure difference to push the rest out. Now open the ""empty"" tank in a vacuum chamber, and then it'll be mostly empty as it releases the gas to equalize the pressure with the vacuum.","&lt;div class=""md""&gt;&lt;p&gt;It&amp;#39;s not empty. It&amp;#39;s just gas at the same pressure as the surrounding atmosphere. There&amp;#39;s no pressure difference to push the rest out. Now open the &amp;quot;empty&amp;quot; tank in a vacuum chamber, and then it&amp;#39;ll be mostly empty as it releases the gas to equalize the pressure with the vacuum.&lt;/p&gt;
&lt;/div&gt;",False,False,False,,,,,0,1714154977.0,1714154977.0,0,,0,False,0,{},l1dxlee,False,,t3_1cdrdus,False,,,,[],t1_l1dxlee,True,,t3_1cdrdus,/r/explainlikeimfive/comments/1cdrdus/eli5_whats_left_in_spent_gas_tanks/l1dxlee/,,,,False,2,False,True,False,explainlikeimfive,t5_2sokd,r/explainlikeimfive,public,,0,[],,2,[],t1
data_3,[],,,False,,kanakamaoli,,,[],,,,text,t2_egn6g,False,False,False,[],,,Empty gas tanks may still have a small amount of product left in them.  Acetylene tanks have the acetylene disolved in acetone liquid.,"&lt;div class=""md""&gt;&lt;p&gt;Empty gas tanks may still have a small amount of product left in them.  Acetylene tanks have the acetylene disolved in acetone liquid.&lt;/p&gt;
&lt;/div&gt;",False,False,False,,,,,0,1714181528.0,1714181528.0,0,,0,False,0,{},l1fwaud,False,,t3_1cdrdus,False,,,,[],t1_l1fwaud,True,,t3_1cdrdus,/r/explainlikeimfive/comments/1cdrdus/eli5_whats_left_in_spent_gas_tanks/l1fwaud/,,,,False,1,False,True,False,explainlikeimfive,t5_2sokd,r/explainlikeimfive,public,,0,[],,1,[],t1
